{
  "build_profile_ref": {
    "path": "validation/evidence/libuv/auto-translation/ip4-addr/l3-ip4-addr-translator-input.json",
    "sha256": "6edff2164a9bfd9af9a81956c2f8fd9d80b9845cd2eca28d55ee1a31c81e1b5a",
    "status": "recorded"
  },
  "cache_invalidation_keys": [
    "source_commit=5e7d51a8f4734cac453db960d4b9919735bbf7c3",
    "slice_spec_sha256=9ba3e754bccd6de3c154736924b9be1c284d4abbc10d5b07589f6855e7e2f1b6",
    "fixture_hash=libuv-ip4-addr-fixture",
    "build_profile_hash=27f452e1250f1ec304a82293e68819618637749d78139ba16b3af9a9318c997e",
    "translator_version=0.1.0",
    "schema_version=1"
  ],
  "level": "L3",
  "mappings": [
    {
      "c_name": "return",
      "c_type": "int",
      "confidence": "proven",
      "id": "type-1",
      "kind": "primitive",
      "rust_type": "i32",
      "source": "translator_rule",
      "translation_rule_id": "supported MVP C subset mapping"
    },
    {
      "c_name": "ip",
      "c_type": "const char*",
      "confidence": "proven",
      "id": "type-2",
      "kind": "pointer",
      "rust_type": "&str",
      "source": "translator_rule",
      "translation_rule_id": "supported MVP C subset mapping"
    },
    {
      "c_name": "port",
      "c_type": "int",
      "confidence": "proven",
      "id": "type-3",
      "kind": "primitive",
      "rust_type": "i32",
      "source": "translator_rule",
      "translation_rule_id": "supported MVP C subset mapping"
    },
    {
      "c_name": "addr",
      "c_type": "struct sockaddr_in*",
      "confidence": "proven",
      "id": "type-4",
      "kind": "pointer",
      "rust_type": "Ip4AddrReport",
      "source": "translator_rule",
      "translation_rule_id": "supported MVP C subset mapping"
    }
  ],
  "repo_commit": "5ea134269754662608534f7b7b99cc601e6a57c7",
  "schema_version": 1,
  "slice_id": "ip4-addr",
  "slice_spec_ref": {
    "path": "validation/slice-specs/libuv-ip4-addr.json",
    "sha256": "9ba3e754bccd6de3c154736924b9be1c284d4abbc10d5b07589f6855e7e2f1b6",
    "status": "ready"
  },
  "source_commit": "5e7d51a8f4734cac453db960d4b9919735bbf7c3",
  "status": "recorded",
  "target_id": "libuv",
  "uncertainties": [],
  "unsupported_nodes": []
}
